{
  "agent": "reference-agent-v1",
  "assertions": {
    "deterministic": [
      {
        "dimension": "conversation",
        "id": "caller-stated-need",
        "kind": "phrase",
        "regex": "my",
        "role": "caller"
      },
      {
        "count": {
          "min": 1
        },
        "dimension": "conversation",
        "id": "caller-turns",
        "kind": "count",
        "phrase": "\\S",
        "role": "caller"
      },
      {
        "dimension": "outcome",
        "id": "outcome-tool",
        "kind": "tool_result",
        "name": "file_claim",
        "result_subset": {
          "status": "filed"
        }
      },
      {
        "dimension": "outcome",
        "expect": {
          "status": "filed"
        },
        "filters": {
          "claim_id": "c_12"
        },
        "id": "outcome-state",
        "kind": "state",
        "resource": "claims"
      },
      {
        "dimension": "conversation",
        "id": "ordered-flow",
        "kind": "sequence",
        "steps": [
          {
            "tool": "lookup_device"
          },
          {
            "tool": "file_claim"
          }
        ]
      }
    ]
  },
  "id": "warranty-claim-test",
  "kind": "hotato.conversation-test",
  "repetitions": 1,
  "scenario": "../scenarios/warranty-claim.scenario.json",
  "success": {
    "report_dimensions": [
      "outcome",
      "policy",
      "conversation",
      "speech"
    ],
    "required": [
      "all_deterministic_assertions_pass"
    ]
  },
  "version": 1
}
