{
  "agent": "reference-agent-v1",
  "assertions": {
    "deterministic": [
      {
        "dimension": "conversation",
        "id": "caller-stated-need",
        "kind": "phrase",
        "regex": "hello,",
        "role": "caller"
      },
      {
        "count": {
          "min": 1
        },
        "dimension": "conversation",
        "id": "caller-turns",
        "kind": "count",
        "phrase": "\\S",
        "role": "caller"
      },
      {
        "dimension": "outcome",
        "id": "outcome-tool",
        "kind": "tool_result",
        "name": "cancel_appointment",
        "result_subset": {
          "status": "cancelled"
        }
      },
      {
        "dimension": "outcome",
        "expect": {
          "status": "cancelled"
        },
        "filters": {
          "appointment_id": "appt_772"
        },
        "id": "outcome-state",
        "kind": "state",
        "resource": "appointments"
      },
      {
        "dimension": "policy",
        "id": "identity-before-action",
        "kind": "sequence",
        "steps": [
          {
            "tool": "verify_identity"
          },
          {
            "tool": "cancel_appointment"
          }
        ]
      },
      {
        "dimension": "policy",
        "id": "required-disclosure",
        "kind": "tool_call",
        "name": "read_disclosure"
      },
      {
        "dimension": "speech",
        "id": "tool-latency",
        "kind": "latency",
        "max_ms": 1500,
        "tool": "cancel_appointment"
      }
    ]
  },
  "id": "appointment-cancel-after-cutoff-test",
  "kind": "hotato.conversation-test",
  "repetitions": 1,
  "scenario": "../scenarios/appointment-cancel-after-cutoff.scenario.json",
  "success": {
    "report_dimensions": [
      "outcome",
      "policy",
      "conversation",
      "speech"
    ],
    "required": [
      "all_deterministic_assertions_pass"
    ]
  },
  "version": 1
}
