{
  "agent": "reference-agent-v1",
  "assertions": {
    "deterministic": [
      {
        "dimension": "conversation",
        "id": "caller-stated-need",
        "kind": "phrase",
        "regex": "order",
        "role": "caller"
      },
      {
        "count": {
          "min": 1
        },
        "dimension": "conversation",
        "id": "caller-turns",
        "kind": "count",
        "phrase": "\\S",
        "role": "caller"
      },
      {
        "dimension": "outcome",
        "id": "outcome-tool",
        "kind": "tool_result",
        "name": "issue_refund",
        "result_subset": {
          "status": "refunded"
        }
      },
      {
        "dimension": "outcome",
        "expect": {
          "refund_status": "refunded"
        },
        "filters": {
          "order_id": "A-3090"
        },
        "id": "outcome-state",
        "kind": "state",
        "resource": "orders"
      }
    ]
  },
  "id": "refund-claimed-not-issued-test",
  "kind": "hotato.conversation-test",
  "repetitions": 1,
  "scenario": "../scenarios/refund-claimed-not-issued.scenario.json",
  "success": {
    "report_dimensions": [
      "outcome",
      "policy",
      "conversation",
      "speech"
    ],
    "required": [
      "all_deterministic_assertions_pass"
    ]
  },
  "version": 1
}
