{
  "agent": "demo-agent",
  "assertions": {
    "deterministic": [
      {
        "dimension": "conversation",
        "id": "agent-said-refund-sent",
        "kind": "phrase",
        "regex": "refund .*sent",
        "role": "agent"
      },
      {
        "dimension": "outcome",
        "id": "outcome-refund-tool",
        "kind": "tool_result",
        "name": "issue_refund",
        "result_subset": {
          "status": "refunded"
        }
      },
      {
        "dimension": "outcome",
        "expect": {
          "refund_status": "refunded"
        },
        "filters": {
          "order_id": "A-3090"
        },
        "id": "outcome-refund-state",
        "kind": "state",
        "resource": "orders"
      }
    ]
  },
  "id": "demo-refund-claimed-not-issued",
  "inconclusive_policy": "report",
  "kind": "hotato.conversation-test",
  "repetitions": 1,
  "success": {
    "report_dimensions": [
      "outcome",
      "conversation"
    ],
    "required": [
      "all_deterministic_assertions_pass"
    ]
  },
  "version": 1
}
